{
  "schema_version": "1.0",
  "kind": "policy",
  "id": "POLICY-001",
  "autonomous_actions": [
    "read",
    "research",
    "local_worktrees",
    "edit_scope",
    "tests",
    "local_containers",
    "commits",
    "reviews",
    "replan"
  ],
  "approval_actions": [
    "remote_push",
    "remote_pr_write",
    "protected_merge",
    "deployment",
    "destructive_database",
    "credentials",
    "paid_services",
    "remote_delete",
    "major_product_scope"
  ],
  "external_grants": [],
  "max_parallel": 4,
  "max_review_cycles": 2,
  "max_rewrites": 3,
  "max_agent_invocations": 300,
  "required_sandbox": false,
  "allow_review_downgrade": false,
  "model_profiles": [
    {
      "name": "implementation",
      "provider": null,
      "model_id": null,
      "capability_rank": 1,
      "configured": false
    },
    {
      "name": "review_high",
      "provider": null,
      "model_id": null,
      "capability_rank": 2,
      "configured": false
    },
    {
      "name": "planning",
      "provider": null,
      "model_id": null,
      "capability_rank": 2,
      "configured": false
    },
    {
      "name": "recovery",
      "provider": null,
      "model_id": null,
      "capability_rank": 2,
      "configured": false
    }
  ]
}
