{
  "schema_version": "1.0",
  "kind": "policy",
  "id": "synthetic-example",
  "autonomous_actions": [
    "synthetic-example"
  ],
  "approval_actions": [
    "synthetic-example"
  ],
  "external_grants": [],
  "max_parallel": 1,
  "max_review_cycles": 1,
  "max_rewrites": 0,
  "max_agent_invocations": 1,
  "required_sandbox": false,
  "allow_review_downgrade": false,
  "model_profiles": [
    {
      "name": "synthetic-example",
      "provider": null,
      "model_id": null,
      "capability_rank": 0,
      "configured": false
    }
  ]
}
